{
  "schema": "qed-glossary-public-relations-v1",
  "catalog_sha256": "e3820038aef21991f67bcfaf850a8eafa85f8f34c202d9392c118334841638f5",
  "profile": "glossary-relations-v1",
  "clusters": [
    {
      "cluster_id": "cluster.glossary.assessment-measurement",
      "revision_id": "revision.cluster.46ff7d2ae1d8e16d867d46c0",
      "title": "Assessment and measurement",
      "description": "Terms for gathering, calculating, interpreting, and comparing evidence in quality assessment.",
      "members": [
        {
          "object_id": "glossary.indicator.evaluation-monitoring",
          "revision_id": "revision.glossary.11aeca0f349b53fd964aa6e7"
        },
        {
          "object_id": "glossary.measure.program-evaluation",
          "revision_id": "revision.glossary.1650402b8d4d151c5bd0f98a"
        },
        {
          "object_id": "glossary.metric.evaluation-performance",
          "revision_id": "revision.glossary.44579986770d811aadd859a4"
        },
        {
          "object_id": "glossary.quality-indicator.quality-assessment",
          "revision_id": "revision.glossary.6b23491c7d734166e0e20506"
        },
        {
          "object_id": "glossary.quality-measure.quality-assessment",
          "revision_id": "revision.glossary.586805af4185c67d08483974"
        },
        {
          "object_id": "glossary.quality-metric.cross-domain-quantitative",
          "revision_id": "revision.glossary.13453aba77e2730f0dd814c4"
        },
        {
          "object_id": "glossary.target.results-monitoring",
          "revision_id": "revision.glossary.f7cffe9d77d8f7a6e5b7793a"
        },
        {
          "object_id": "glossary.threshold.decision-boundary",
          "revision_id": "revision.glossary.31f335605b14e5b55e1694b8"
        }
      ]
    }
  ],
  "relations": [
    {
      "relation_id": "relation.glossary.accuracy-distinguished-from-precision",
      "revision_id": "revision.relation.0fae32d16ff8bca6f1110590",
      "source": {
        "object_id": "glossary.accuracy.measurement",
        "revision_id": "revision.glossary.35aab25a4ea0fe41413bc10e"
      },
      "target": {
        "object_id": "glossary.precision.measurement",
        "revision_id": "revision.glossary.7a33b289c3fe7cdf1a838d40"
      },
      "predicate": "distinguished-from",
      "scope": "Measurement results and repeated measurements under specified conditions",
      "label": "distinguished from",
      "explanation": "Accuracy concerns how close a measured result is to an accepted reference value; precision concerns how closely repeated results agree with one another.",
      "review": {
        "owner_editorial": true,
        "owner_source_attestation": true,
        "internal_validation": true,
        "owner_release_authorization": true,
        "independent_external_review": false
      }
    },
    {
      "relation_id": "relation.glossary.appraisal-cost-distinguished-from-prevention-cost",
      "revision_id": "revision.relation.cd7d3c8e5a413ca89a6a4502",
      "source": {
        "object_id": "glossary.appraisal-cost.assessing-conformity",
        "revision_id": "revision.glossary.d28fbccfb04e771e74578602"
      },
      "target": {
        "object_id": "glossary.prevention-cost.avoiding-nonconformity",
        "revision_id": "revision.glossary.27ea465bb3f58dc7a962d4c9"
      },
      "predicate": "distinguished-from",
      "scope": "Quality-cost activities classified by whether they assess conformity or aim to prevent failures",
      "label": "distinguished from",
      "explanation": "Appraisal cost is spending to assess whether products, services, or processes meet requirements; prevention cost is spending intended to avert defects or other quality failures.",
      "review": {
        "owner_editorial": true,
        "owner_source_attestation": true,
        "internal_validation": true,
        "owner_release_authorization": true,
        "independent_external_review": false
      }
    },
    {
      "relation_id": "relation.glossary.availability-distinguished-from-reliability",
      "revision_id": "revision.relation.b70807d9c8ebd75e3dfebaa2",
      "source": {
        "object_id": "glossary.availability.engineered-system",
        "revision_id": "revision.glossary.93b216acb9a1fdf1277db922"
      },
      "target": {
        "object_id": "glossary.reliability.cross-domain",
        "revision_id": "revision.glossary.4ee64845069e84c0f36eb1c3"
      },
      "predicate": "distinguished-from",
      "scope": "Engineered systems and items under stated operating conditions; reliability's test-score sense is excluded",
      "label": "distinguished from",
      "explanation": "Availability concerns whether a system is operable when needed at a given time; engineered-item reliability concerns performing as required without failure over a stated interval.",
      "review": {
        "owner_editorial": true,
        "owner_source_attestation": true,
        "internal_validation": true,
        "owner_release_authorization": true,
        "independent_external_review": false
      }
    },
    {
      "relation_id": "relation.glossary.control-limit-distinguished-from-specification-limit",
      "revision_id": "revision.relation.f9b82ef45d9e9ea8c9f7f088",
      "source": {
        "object_id": "glossary.control-limit.process-monitoring",
        "revision_id": "revision.glossary.2036a2f70c7449019061b2a6"
      },
      "target": {
        "object_id": "glossary.specification-limit.acceptability-boundary",
        "revision_id": "revision.glossary.1ae87076896d791dd209f8e7"
      },
      "predicate": "distinguished-from",
      "scope": "Statistical process control and acceptability of a specified characteristic",
      "label": "distinguished from",
      "explanation": "A control limit is calculated from process data to help assess process behavior; a specification limit states a boundary for acceptable values of a characteristic.",
      "review": {
        "owner_editorial": true,
        "owner_source_attestation": true,
        "internal_validation": true,
        "owner_release_authorization": true,
        "independent_external_review": false
      }
    },
    {
      "relation_id": "relation.glossary.quality-indicator-is-a-indicator",
      "revision_id": "revision.relation.136fc35415e2dd5aabe4dc65",
      "source": {
        "object_id": "glossary.quality-indicator.quality-assessment",
        "revision_id": "revision.glossary.6b23491c7d734166e0e20506"
      },
      "target": {
        "object_id": "glossary.indicator.evaluation-monitoring",
        "revision_id": "revision.glossary.11aeca0f349b53fd964aa6e7"
      },
      "predicate": "is-a",
      "scope": "Quality assessment used for evaluation or monitoring",
      "label": "is a kind of",
      "explanation": "A quality indicator used to track or assess quality is an indicator with quality as its focus.",
      "review": {
        "owner_editorial": true,
        "owner_source_attestation": true,
        "internal_validation": true,
        "owner_release_authorization": true,
        "independent_external_review": false
      }
    }
  ]
}
